ID,Name,Summary,Opportunity
UC01,FrontLine - Partnership Banking,GenAI-driven RM solutions for deepening banker-customer relationships.,Increased revenue through improved cross-sell / upsell effectiveness; Enhanced customer satisfaction and retention; Reduced relationship manager preparation time; Improved customer lifetime value; Better risk identification and proactive engagement.
UC02,Finance,"Transform raw financial data into well-structured reports (P&L, balance sheets).",Reduced month-end close time; Improved accuracy and reduced manual errors; Faster decision-making with real-time insights; Enhanced regulatory compliance; Reduced FTE costs in financial reporting.
UC03,Analytics and Reporting,AI builds on BI by turning historical data into proactive guidance.,Democratized data access reducing analyst dependency; Proactive decision-making with predictive capabilities; Reduced report generation time from days to minutes; Improved business agility and responsiveness; Enhanced data-driven culture across organization.
UC04,Credit Risk,GenAI-driven Credit Risk solutions for data-driven decision-making.,Reduced credit losses through better risk assessment; Faster loan approval times improving customer experience; Optimized pricing increasing profitability; Enhanced portfolio monitoring reducing defaults; Improved regulatory compliance and capital efficiency.
UC05,Lending Ops,AI Document Processing for Loan Applications & Compliance.,Processing time reduction for loan applications; Improved accuracy reducing rework; Enhanced compliance with automated validation; Reduced operational costs; Faster time-to-yes improving customer satisfaction
UC06,HyperPersonalization,Generative AI enables new customer relevance through marketing reinvention.,Increased campaign conversion rates; Higher customer engagement and satisfaction scores; Improved product adoption; Reduced customer churn; Enhanced brand loyalty and NPS scores
UC07,Contact Centre,"Generate call summaries, agent-assist features, customer self-service.",Reduced average handle time; Improved first call resolution; Enhanced customer satisfaction (CSAT) scores; Reduced agent training time; Lower operational costs through automation of inquiries
UC08,Security AI,Use of AI to identify threats earlier with higher accuracy.,Reduced threat detection time from hours to minutes; reduction in false positives; Prevented potential losses from cyber attacks; Enhanced regulatory compliance and risk management; Improved security team efficiency.
UC09,Data Products,Extend GenAI intervention to accelerate data product creation.,Accelerated data product delivery; Improved data quality and consistency; Enhanced data discoverability and reusability; Reduced time-to-insight for business users; Lower data engineering costs.
UC10,SDLC,"GenAI can automate key SDLC tasks, enhancing productivity.",Developer productivity increased; Faster time-to-market; Reduced bugs and security vulnerabilities; Improved code quality and maintainability; Lower technical debt accumulation.
UC11,Fincrime,"Name screening, OCDD, ECDD and TM narrative writing.",Reduced investigation time; Improved detection accuracy reducing false positives; Enhanced regulatory compliance and audit readiness; Lower operational costs; Faster filing and response times.
UC12,QA/QC,"Automate data validation, detecting errors, ensuring compliance.",Reduced manual QA effort; Improved data quality and accuracy; Faster identification of high-risk issues; Enhanced regulatory compliance; Lower operational risk and audit findings.
UC13,Fraud Ops,AI support for case officers through pattern detection and evidence gathering.,Reduced fraud investigation time; Prevented fraud losses; Improved detection accuracy; Enhanced case officer productivit; Better customer experience with faster resolution.
UC14,Onboarding,"AI streamlines onboarding by automating ID verification, KYC checks.",Reduced onboarding time from days to hours; Improved customer experience and conversion rates; Enhanced compliance with automated checks; Lower operational costs; Reduced abandonment rates.
UC15,Risk Functions,AI reduces Operational Risk by identifying anomalies.,Improved risk detection reducing losses; Faster risk assessment and response times; Enhanced regulatory compliance and capital optimization; Reduced manual effort; Better enterprise-wide risk visibility and management.
UC16,IT Ops,Evolution of Ticketing Process and Smart Routing.,Reduced mean time to resolution (MTTR); Automated resolution of tickets; Improved SLA compliance and user satisfaction; Lower IT support costs; Better workload distribution and resource optimization.
UC17,FrontLine - CIB,GenAI-driven RM solutions for Corporate and Investment Banking.,Increased wallet share with corporate clients; Enhanced deal win rates; Improved relationship manager productivity; Better market intelligence and competitive positioning; Reduced client attrition and increased loyalty.
UC18,Procurement,Multi-Agent System for End-to-end Procurement process optimization.,Cost savings through optimized sourcing; Reduced procurement cycle time; Improved supplier performance and risk management; Enhanced spend visibility and control; Lower invoice processing costs.
UC19,Payment Disputes,Automate end-to-end lifecycle of card payment disputes.,Reduced dispute resolution time; Improved win rates on chargebacks; Enhanced customer satisfaction with faster resolutions; Lower operational costs; Better compliance with card scheme requirements.
UC20,Controls Testing,Automate IT and business control testing.,Reduced testing effort; Continuous controls monitoring vs periodic testing; Improved control effectiveness and compliance; Earlier detection of control deficiencies; Lower audit costs and faster audit cycles.
UC21,Wholesale Underwriting,End-to-end transformation of CIB Risk Underwriting process.,Reduced underwriting time; Improved risk-adjusted pricing and profitability; Enhanced portfolio quality with continuous monitoring; Faster deal turnaround improving competitiveness; Lower credit losses through better risk assessment.
UC22,Learning Content,AI accelerates content creation by generating lessons and quizzes.,Reduced content creation time; Improved training personalization and effectiveness; Enhanced learning engagement and completion rates; Lower training development costs; Faster time-to-competency for new roles.
UC23,Collection Management,AI optimises collections by predicting payment likelihood.,Improved recovery rates; Reduced collection costs; Better customer treatment and satisfaction; Optimized collector productivity; Lower write-offs through early intervention and targeted strategies.
UC24,Front-end App Personalisation,Use of GenAI in mobile app for hyper personalisation.,Increased app engagement; Higher product adoption through personalized recommendations; Improved NPS and customer satisfaction scores; Reduced marketing campaign costs; Enhanced brand differentiation with Uber-like experience.
