"ID","L0_Domain","L1_Group","Level","Source","Primary_Capability","Capability_Name","Definition","Key_Components","Technologies","BNZ_Status","Priority","Maturity_Basic","Maturity_Intermediate","Maturity_Advanced","Maturity_Optimized","Success_Metrics"
"CP-335","Enabling","Transformation & Governance","L2","Governance","4. Model Lifecycle Governance","4.3 Model Documentation & Lineage","Maintain comprehensive documentation of models and track their complete lineage from data sources through deployment","Model Cards; Technical Documentation; Data Lineage; Development History; Dependency Mapping; Change History; Usage Documentation","Model card generation tools; Documentation automation platforms; Lineage tracking systems; Dependency graph tools; Version control systems","Gap","High","Manual documentation, incomplete lineage, scattered information","Structured documentation, basic lineage, centralized storage","Automated documentation, comprehensive lineage, integrated systems","Self-documenting models, real-time lineage, AI-generated documentation","Documentation completeness score (%); Lineage coverage (%); Documentation update lag (days); Documentation access time (minutes); Audit finding rate on documentation (%)"
"CP-336","Enabling","Transformation & Governance","L2","Governance","4. Model Lifecycle Governance","4.4 Model Performance Monitoring","Continuously monitor model performance in production, detecting degradation, drift, and anomalies in real-time","Performance Metrics Tracking; Data Drift Detection; Concept Drift Detection; Anomaly Detection; Alerting & Notification; Performance Dashboards; Automated Remediation","Model monitoring platforms (Evidently AI, WhyLabs, Arize); Data drift detection tools; Real-time alerting systems; Performance dashboards; Automated remediation frameworks","Gap","High","Manual monitoring, periodic reviews, reactive approach","Automated metrics collection, basic alerting, regular reviews","Real-time monitoring, comprehensive drift detection, proactive alerts","Predictive monitoring, self-healing models, automated retraining","Monitoring coverage (% of production models); Drift detection accuracy (%); Alert response time (minutes); False positive alert rate (%); Model performance incidents (#)"
"CP-337","Enabling","Transformation & Governance","L2","Governance","4. Model Lifecycle Governance","4.5 Model Versioning & Change Management","Manage model versions, control changes, and ensure safe updates to production models","Version Control; Change Request Management; Impact Assessment; Deployment Strategies; Rollback Capability; Change Documentation; Approval Gates","Version control systems (Git, DVC); Change management platforms; Deployment automation tools; Feature flags and experimentation platforms; Rollback automation","Gap","High","Manual versioning, uncontrolled changes, risky deployments","Automated versioning, change requests, basic deployment strategies","Comprehensive version control, controlled deployments, quick rollback","Automated change management, zero-downtime deployments, instant rollback","Change request approval time (days); Deployment success rate (%); Rollback frequency (#); Change-related incidents (#); Deployment lead time (hours)"
"CP-338","Enabling","Transformation & Governance","L2","Governance","4. Model Lifecycle Governance","4.6 Model Retirement & Decommissioning","Safely retire and decommission models that are no longer needed, performing poorly, or have been superseded","Retirement Criteria; Retirement Planning; Dependency Analysis; Data Archival; Documentation Update; Communication; Audit Trail","Lifecycle management platforms; Dependency analysis tools; Archival systems; Notification systems; Audit logging systems","Gap","Medium","Ad-hoc retirement, manual processes, incomplete documentation","Defined criteria, planned retirement, basic archival","Automated retirement triggers, comprehensive archival, stakeholder notification","Predictive retirement, automated decommissioning, complete lifecycle management","Retirement planning lead time (weeks); Successful retirements without incidents (%); Documentation completeness at retirement (%); Orphaned models in production (#); Archival completeness (%)"
"CP-339","Enabling","Transformation & Governance","L2","Governance","5. Governance Operations & Monitoring","5.1 Governance Dashboards & Reporting","The ability to provide real-time visibility into governance metrics compliance status and risk posture through comprehensive dashboards and reports","Executive Dashboards; Operational Dashboards; Compliance Dashboards; Risk Dashboards; Custom Reports; Automated Reporting; Drill-Down Capability","Business intelligence platforms (Tableau, Power BI, Looker); Data visualization tools; Report automation platforms; Data warehouse and analytics; Dashboard development frameworks","Gap","Medium","Manual reporting, static reports, limited visualization","Semi-automated reports, basic dashboards, regular updates","Real-time dashboards, interactive visualizations, automated distribution","AI-powered insights, predictive analytics, self-service analytics","Dashboard availability (uptime %); Report generation time (hours); Data freshness (lag time); Dashboard user adoption (%); Stakeholder satisfaction with reporting (%)"
"CP-340","Enabling","Transformation & Governance","L2","Governance","5. Governance Operations & Monitoring","5.2 Continuous Monitoring & Alerting","Continuously monitor AI systems, governance controls, and compliance status with real-time alerting for issues","Real-Time Monitoring; Automated Alert Rules; Alert Prioritization; Alert Routing; Alert Response Tracking; Alert Analytics; False Positive Management","Continuous monitoring platforms; Alerting and notification systems; Log aggregation and analysis; Anomaly detection systems; Alert management platforms","Gap","Medium","Manual monitoring, reactive alerts, limited coverage","Automated monitoring, basic alerting, regular reviews","Real-time monitoring, intelligent alerting, comprehensive coverage","Predictive monitoring, AI-powered alerting, self-healing systems","Monitoring coverage (%); Alert response time (minutes); False positive rate (%); Alert resolution time (hours); Undetected incidents (#)"
"CP-341","Enabling","Transformation & Governance","L2","Governance","5. Governance Operations & Monitoring","5.3 Compliance Testing & Validation","Regularly test and validate compliance controls, policies, and procedures to ensure they are operating effectively","Control Testing; Policy Validation; Automated Testing; Test Case Management; Test Evidence Collection; Finding Management; Continuous Testing","Compliance testing frameworks; Automated testing tools; Test management platforms; Evidence collection systems; Finding tracking systems","Gap","Medium","Manual testing, periodic reviews, limited coverage","Regular testing, documented test plans, basic automation","Automated testing, continuous testing, comprehensive coverage","Continuous validation, self-testing systems, predictive testing","Testing coverage (% of controls); Test frequency (tests per month); Control failure rate (%); Finding remediation time (days); Repeat findings (#)"
"CP-342","Enabling","Transformation & Governance","L2","Governance","5. Governance Operations & Monitoring","5.4 Governance Metrics & KPIs","Define, collect, analyze, and report on key performance indicators (KPIs) and metrics that measure governance effectiveness","KPI Framework; Metrics Definition; Data Collection; Benchmarking; Trend Analysis; Target Setting; Performance Reporting","KPI management platforms; Data collection and aggregation tools; Analytics and reporting platforms; Benchmarking databases; Target tracking systems","Gap","Medium","Limited metrics, manual collection, inconsistent reporting","Defined KPIs, semi-automated collection, regular reporting","Comprehensive KPIs, automated collection, trend analysis","Predictive KPIs, real-time metrics, AI-powered insights","KPI coverage (% of governance areas); Data quality score (%); Reporting timeliness (%); KPI target achievement rate (%); Stakeholder use of metrics (%)"
"CP-343","Enabling","Transformation & Governance","L2","Governance","5. Governance Operations & Monitoring","5.5 Continuous Improvement & Maturity Assessment","Systematically assess governance maturity, identify improvement opportunities, and implement continuous improvement initiatives","Maturity Assessment; Gap Analysis; Improvement Planning; Best Practice Integration; Lessons Learned; Process Optimization; Change Management","Maturity assessment frameworks; Gap analysis tools; Project management platforms; Best practice repositories; Change management systems","Gap","Medium","Ad-hoc assessments, limited improvement focus, reactive changes","Regular assessments, documented improvements, planned changes","Continuous assessment, systematic improvement, proactive optimization","Self-assessment, AI-driven improvement, continuous evolution","Maturity score improvement (annual); Improvement initiative completion rate (%); Time to implement improvements (weeks); Stakeholder feedback on improvements (%); Return on governance investment (%)"
"CP-344","Enabling","Transformation & Governance","L2","capability-model","CAP-L2-GOV-01-01","Model Registry","Maintain a centralized authoritative catalog of all AI/ML models with comprehensive metadata, versioning, lineage, and lifecycle status","Patterns: PT-001, PT-002","ABBs: AB-060, AB-086","Gap","High","Spreadsheet tracking of models","Centralized registry with basic metadata","Comprehensive registry with full lineage and automated registration","AI-powered registry with semantic search and model recommendations","Number of models registered | Registry completeness (%) | Model discovery time (minutes) | Metadata quality score"
"CP-345","Enabling","Transformation & Governance","L2","capability-model","CAP-L2-GOV-01-02","Model Lifecycle Management","Manage models through their complete lifecycle from development through retirement, enforcing governance at each stage","Patterns: PT-001, PT-002","ABBs: AB-088","Gap","High","Ad-hoc model management","Defined lifecycle stages with manual gates","Automated lifecycle management with validation","Intelligent lifecycle orchestration with predictive retirement","Models in each lifecycle stage | Lifecycle transition time (days) | Retirement compliance rate (%) | Lifecycle automation percentage"
"CP-346","Enabling","Transformation & Governance","L2","capability-model","CAP-L2-GOV-01-03","Model Approval Workflow","Enforce multi-level approval gates ensuring models meet quality, compliance, and business requirements before deployment","Patterns: PT-001","ABBs: AB-062","Gap","High","No formal approval process","Basic approval workflow with 2-3 gates","Multi-level approval with role-based reviewers and automated checks","Intelligent approval routing with risk-based escalation and parallel reviews","Approval cycle time (days) | Approval rejection rate (%) | Gate compliance (%) | Reviewer workload balance"
"CP-347","Enabling","Transformation & Governance","L2","capability-model","CAP-L2-GOV-01-04","Model Versioning","Track and manage model versions with semantic versioning, enabling rollback and concurrent version operation","Patterns: PT-002, PT-010","ABBs: AB-086, AB-091","Gap","High","No version control","Basic version numbering","Semantic versioning with automated tagging and branching","Full GitOps for models with version graphs and impact analysis","Versions per model (average) | Version tracking completeness (%) | Rollback time (minutes) | Version co-existence capability"
"CP-348","Enabling","Transformation & Governance","L2","capability-model","CAP-L2-GOV-02-01","Model Risk Assessment","Automatically assess and classify model risk levels using standardized frameworks, supporting regulatory compliance","Patterns: PT-001","ABBs: AB-061","Gap","High","Manual risk assessment","Rule-based risk scoring","Automated risk assessment with multi-dimensional analysis","AI-powered continuous risk monitoring with predictive alerts","Risk assessment coverage (%) | Risk classification accuracy (%) | Assessment cycle time (hours) | Risk profile currency (days)"
"CP-349","Enabling","Transformation & Governance","L2","capability-model","CAP-L2-GOV-02-02","Compliance Monitoring","Continuously monitor AI systems for compliance with regulations including GDPR, NZ Privacy Act, and banking requirements","Track compliance with GDPR, AML, Model Risk policies","Patterns: PT-001","ABBs: AB-064","Gap","High","Manual quarterly compliance checks","Automated compliance scanning monthly","Continuous compliance monitoring with real-time alerts","Predictive compliance with automated remediation"
"CP-350","Enabling","Transformation & Governance","L2","capability-model","CAP-L2-GOV-02-03","Regulatory Reporting","Generate comprehensive compliance reports for regulatory submissions and audits with full evidence and documentation","Patterns: PT-001","ABBs: AB-064","Gap","High","Manual report compilation","Semi-automated reports with templates","Fully automated reporting with audit evidence","AI-generated regulatory narratives with continuous compliance validation","Report generation time (hours) | Report completeness (%) | Audit finding rate | Regulatory submission timeliness (%)"
"CP-351","Enabling","Transformation & Governance","L2","capability-model","CAP-L2-GOV-02-04","Policy Enforcement","Automatically enforce governance policies at runtime through gateway controls, preventing non-compliant AI usage","Patterns: PT-001","ABBs: AB-066","Gap","High","Manual policy compliance review","Gateway-based policy checks at deployment","Real-time policy enforcement for all AI operations","Intelligent policy enforcement with context-aware exceptions and learning","Policy enforcement coverage (%) | Policy violation prevention rate (%) | False positive rate (%) | Enforcement latency (ms)"
"CP-352","Enabling","Transformation & Governance","L2","capability-model","CAP-L2-GOV-03-01","Model Explainability","Generate human-understandable explanations for model predictions using SHAP, LIME, and other XAI techniques","Patterns: PT-004","ABBs: AB-063, AB-068","Gap","High","No explainability","Manual explanation generation for escalations","Automated SHAP/LIME explanations for key models","Real-time explanations for all predictions with multi-level detail","Explainability coverage (% of models) | Explanation generation time (seconds) | Stakeholder understanding rate (%) | Explanation quality score"
"CP-353","Enabling","Transformation & Governance","L2","capability-model","CAP-L2-GOV-03-02","Bias Detection","Automatically detect algorithmic bias across demographic groups, identifying unfair treatment in AI decision-making","Patterns: PT-004","ABBs: AB-069, AB-046","Gap","High","No bias testing","Manual bias analysis for high-risk models","Automated bias detection for all models with statistical tests","Continuous bias monitoring with intersectional analysis and predictive alerts","Bias detection coverage (%) | Bias detection accuracy (%) | Disparate impact ratio | Fairness metric compliance (%)"
"CP-354","Enabling","Transformation & Governance","L2","capability-model","CAP-L2-GOV-03-03","Fairness Monitoring","Continuously monitor fairness metrics in production, alerting on fairness degradation and demographic performance gaps","Patterns: PT-004","ABBs: AB-046","Gap","High","No fairness monitoring","Quarterly fairness reviews","Continuous fairness monitoring with dashboards","Predictive fairness analytics with auto-correction recommendations","Fairness metrics tracked | Alert response time (hours) | Fairness violation rate | Monitoring coverage (% of models)"
"CP-355","Enabling","Transformation & Governance","L2","capability-model","CAP-L2-GOV-03-04","Explanation Visualization","Present model explanations through intuitive visual dashboards enabling non-technical stakeholders to understand AI decisions","Patterns: PT-004","ABBs: AB-128","Gap","Medium","Text-only explanations","Basic charts for feature importance","Interactive dashboards with drill-down capabilities","AI-powered explanation narratives with persona-based customization","Dashboard adoption rate (%) | User comprehension score | Time to insight (minutes) | Stakeholder satisfaction"
"CP-356","Enabling","Transformation & Governance","L2","capability-model","CAP-L2-GOV-04-01","Audit Trail","Maintain immutable comprehensive logs of all AI decisions, model changes, and governance activities for compliance and forensics","Patterns: PT-001","ABBs: AB-065","Partial","High","Basic application logs","Centralized audit logs with retention","Immutable audit trail with blockchain-like integrity","AI-analyzed audit trail with anomaly detection and automated compliance validation","Audit log completeness (%) | Log retention compliance (%) | Audit query performance | Tamper detection effectiveness"
"CP-357","Enabling","Transformation & Governance","L2","capability-model","CAP-L2-GOV-04-02","Data Lineage","Track complete data lineage from source systems through transformations to AI predictions, enabling impact analysis and compliance","Patterns: PT-001, PT-012","ABBs: AB-070, AB-123","Gap","High","No lineage tracking","Manual lineage documentation","Automated lineage capture with visualization","Real-time lineage tracking with impact analysis and change propagation","Lineage coverage (% of data flows) | Lineage accuracy (%) | Trace time (minutes) | Impact analysis completeness (%)"
"CP-358","Enabling","Transformation & Governance","L2","capability-model","CAP-L2-GOV-04-03","Model Lineage","Track model dependencies including training data, features, code, and parent models enabling reproducibility and impact analysis","Patterns: PT-001","ABBs: AB-070","Gap","High","No model lineage","Manual model documentation","Automated lineage capture with version control","Complete model provenance with dependency graphs and automated reproducibility","Model lineage completeness (%) | Reproducibility success rate (%) | Dependency tracking accuracy (%) | Lineage query time (seconds)"
"CP-359","Enabling","Transformation & Governance","L2","capability-model","CAP-L2-GOV-04-04","Decision Provenance","Reconstruct the complete chain of reasoning for any AI decision including model version, input data, and intermediate steps","Patterns: PT-001, PT-004","ABBs: AB-065","Gap","High","No decision tracing","Basic decision logging","Complete decision reconstruction with evidence","Real-time decision provenance with interactive exploration and what-if analysis","Decision trace completeness (%) | Reconstruction success rate (%) | Trace retrieval time (seconds) | Audit satisfaction score"
"CP-360","Enabling","Transformation & Governance","L2","capability-model","CAP-L2-GOV-05-01","Cost Attribution","Accurately attribute AI infrastructure and service costs to specific models, use cases, and business units for chargeback","Patterns: PT-001","ABBs: AB-067","Gap","High","No cost tracking","Basic cost tagging by environment","Detailed cost attribution to models and use cases","Real-time cost allocation with predictive budgeting and optimization recommendations","Cost attribution accuracy (%) | Attribution granularity (levels) | Cost visibility (% of spend) | Chargeback automation rate (%)"
"CP-361","Enabling","Transformation & Governance","L2","capability-model","CAP-L2-GOV-05-02","Budget Enforcement","Enforce cost budgets and quotas at model and use case level, preventing cost overruns through automated controls","Patterns: PT-007","ABBs: AB-009","Gap","High","No budget controls","Manual budget monitoring","Automated budget alerts and throttling","Predictive budget management with intelligent cost controls and optimization","Budget compliance rate (%) | Cost overrun prevention (%) | Budget alert accuracy (%) | Cost savings from enforcement ($)"
"CP-362","Enabling","Transformation & Governance","L2","capability-model","CAP-L2-GOV-05-03","Cost Optimization","Identify and recommend cost optimization opportunities across models, infrastructure, and LLM usage","Patterns: PT-006","ABBs: AB-100","Gap","High","No cost optimization","Manual cost reviews quarterly","Automated optimization recommendations monthly","AI-powered continuous optimization with auto-implementation","Cost reduction achieved (%) | Recommendations generated per month | Implementation rate (%) | ROI of optimization efforts"
"CP-363","Enabling","Transformation & Governance","L2","capability-model","CAP-L2-GOV-05-04","Chargeback Reporting","Generate detailed cost allocation reports for business units showing AI consumption and costs for internal billing","Patterns: PT-001","ABBs: AB-067","Gap","Medium","No chargeback","Manual monthly chargeback spreadsheets","Automated chargeback reports with drill-down","Real-time chargeback dashboard with usage analytics and optimization guidance","Chargeback accuracy (%) | Report generation time (hours) | Stakeholder satisfaction | Dispute resolution time (days)"
"CP-364","Enabling","Technologies & Enablement","L0","capability-model","CAP-L0-OBS: Observability","Observability","Monitoring, alerting, and platform visibility","","","","","","","","",""
"CP-365","Enabling","Technologies & Enablement","L1","capability-model","CAP-L1-OBS-01","Platform Monitoring","L1 Capability Group: Platform Monitoring","","","","","","","","",""
"CP-366","Enabling","Technologies & Enablement","L1","capability-model","CAP-L1-OBS-02","Model Monitoring","L1 Capability Group: Model Monitoring","","","","","","","","",""
"CP-367","Enabling","Technologies & Enablement","L1","capability-model","CAP-L1-OBS-03","Business Monitoring","L1 Capability Group: Business Monitoring","","","","","","","","",""
"CP-368","Enabling","Technologies & Enablement","L1","capability-model","CAP-L1-OBS-04","Dashboards & Reporting","L1 Capability Group: Dashboards & Reporting","","","","","","","","",""
"CP-369","Enabling","Technologies & Enablement","L2","capability-model","CAP-L2-OBS-01-01","Metrics Collection","Collect comprehensive system and business metrics from all AI platform components for monitoring and analysis","Patterns: PT-017","ABBs: AB-096","Partial","High","Manual metrics collection","Automated collection from key components","Comprehensive metrics from all components with custom metrics support","Intelligent metrics with adaptive sampling and anomaly-based collection","Number of metrics collected | Collection overhead (%) | Metrics coverage (% of components) | Collection reliability (%)"
"CP-370","Enabling","Technologies & Enablement","L2","capability-model","CAP-L2-OBS-01-02","Log Aggregation","Centralize and index logs from all services, enabling search, analysis, and correlation across the platform","Patterns: PT-017","ABBs: AB-096","Partial","High","Local log files","Centralized logging with basic search","Structured logging with rich indexing and correlation","AI-powered log analysis with automatic pattern detection and insights","Log volume (GB/day) | Log retention (days) | Search query performance | Log correlation effectiveness"
"CP-371","Enabling","Technologies & Enablement","L2","capability-model","CAP-L2-OBS-01-03","Distributed Tracing","Trace requests end-to-end across microservices, identifying bottlenecks and understanding system behavior","Patterns: PT-017","ABBs: AB-096","Gap","High","No distributed tracing","Basic tracing for select services","Comprehensive tracing with <5% sampling overhead","Intelligent tracing with dynamic sampling and automatic bottleneck identification","Tracing coverage (% of requests) | Trace retention | Mean time to identify bottleneck (minutes) | Tracing overhead (%)"
"CP-372","Enabling","Technologies & Enablement","L2","capability-model","CAP-L2-OBS-01-04","Alerting","Generate intelligent alerts for anomalies, threshold breaches, and SLA violations with smart routing and noise reduction","Patterns: PT-017","ABBs: AB-102","Partial","High","Basic threshold alerts","Alert rules with notification channels","Smart alerting with anomaly detection and alert grouping","AI-powered predictive alerts with context and auto-remediation suggestions","Alert response time (minutes) | False positive rate (%) | Alert coverage (% of critical issues) | Alert fatigue score"
"CP-373","Enabling","Technologies & Enablement","L2","capability-model","CAP-L2-OBS-02-01","Performance Monitoring","Continuously monitor model performance metrics including accuracy, latency, throughput, and resource utilization","Track accuracy, latency, throughput","Patterns: PT-017","ABBs: AB-096","Gap","High","Manual periodic checks","Automated dashboards with key metrics","Real-time monitoring with SLA tracking","Predictive performance monitoring with degradation alerts"
"CP-374","Enabling","Technologies & Enablement","L2","capability-model","CAP-L2-OBS-02-02","Data Drift Detection","Detect changes in input data distribution that may degrade model performance, triggering retraining or alerts","Patterns: PT-017","ABBs: AB-097","Gap","High","No drift detection","Monthly statistical drift tests","Weekly automated drift detection with alerting","Real-time drift detection with impact quantification and auto-remediation","Drift detection latency (hours) | Detection accuracy (%) | False positive rate (%) | Coverage (% of features monitored)"
"CP-375","Enabling","Technologies & Enablement","L2","capability-model","CAP-L2-OBS-02-03","Prediction Drift Detection","Detect changes in model output distribution indicating potential model degradation or data issues","Patterns: PT-017","ABBs: AB-098","Gap","High","No prediction monitoring","Monthly output analysis","Weekly prediction drift detection","Real-time prediction drift monitoring with root cause analysis","Detection latency (hours) | Drift correlation with performance (%) | Alert precision (%) | Monitoring coverage (%)"
