"ID","L0_Domain","L1_Group","Level","Source","Primary_Capability","Capability_Name","Definition","Key_Components","Technologies","BNZ_Status","Priority","Maturity_Basic","Maturity_Intermediate","Maturity_Advanced","Maturity_Optimized","Success_Metrics"
"CP-107","Agentic AI","Agents","L2","capability-model","CAP-L2-AGT-01-03","Agent Memory","Provide agents with both short-term (working) and long-term (episodic/semantic) memory systems, enabling agents to learn from experience, maintain context, and build knowledge over time","Patterns: PT-007","ABBs: AB-003","Gap","High","Session-only memory with no persistence","Short-term memory with basic cross-session retrieval","Structured memory with semantic organization and intelligent pruning","Hierarchical memory with associative recall and continuous learning","Memory retrieval accuracy (%) | Context retention across sessions (%) | Memory query latency (ms) | Knowledge accumulation rate"
"CP-108","Agentic AI","Agents","L2","capability-model","CAP-L2-AGT-01-04","Task Planning","Decompose complex high-level goals into actionable task sequences, creating execution plans that consider dependencies, priorities, and resource constraints while adapting to changing conditions","Patterns: PT-007","ABBs: AB-004","Gap","High","Linear task lists with no adaptation","Basic planning with dependency tracking for 5-10 step plans","Hierarchical planning with dynamic replanning and constraint satisfaction","AI-driven planning with multi-objective optimization and predictive adaptation","Plan quality score | Replanning frequency | Plan execution success rate (%) | Planning latency (seconds)"
"CP-109","Agentic AI","Agents","L2","capability-model","CAP-L2-AGT-01-05","Plan Execution","Reliably execute planned actions, handling tool invocations, managing execution state, implementing error recovery, and ensuring task completion despite failures or unexpected conditions","Patterns: PT-007","ABBs: AB-005","Gap","High","Manual execution with no recovery","Automated execution with basic retry logic","Robust execution with circuit breakers and graceful degradation","Self-healing execution with predictive failure prevention and alternative path finding","Task execution success rate (%) | Recovery time from failures (seconds) | Execution reliability (%) | Error handling effectiveness"
"CP-110","Agentic AI","Agents","L2","capability-model","CAP-L2-AGT-02-01","Self-Reflection","Agents to evaluate their own performance, identify mistakes, and adjust strategies through introspection and self-critique, leading to continuous improvement in decision quality","Patterns: PT-007","ABBs: AB-006","Gap","Medium","No self-evaluation","Basic performance logging with manual review","Automated reflection with quality scoring and adjustment triggers","Continuous self-improvement with meta-learning and strategy optimization","Reflection frequency (per task) | Quality improvement rate (%) | Error detection accuracy (%) | Self-correction success rate (%)"
"CP-111","Agentic AI","Agents","L2","capability-model","CAP-L2-AGT-02-02","Multi-Step Reasoning","Perform complex logical inference across multiple reasoning steps, maintaining consistency, tracking dependencies, and building valid conclusions from premises through chain-of-thought processes","Patterns: PT-007","ABBs: AB-001","Gap","High","Single-step inference only","3-5 step reasoning chains","10+ step reasoning with logical verification","Complex multi-hop reasoning with automated proof checking and explanation","Reasoning depth (steps) | Logical consistency score (%) | Reasoning time (seconds) | Conclusion validity rate (%)"
"CP-112","Agentic AI","Agents","L2","capability-model","CAP-L2-AGT-02-03","Learning from Feedback","Incorporate user corrections, ratings, and feedback into agent behavior, updating models, strategies, and knowledge to improve future performance based on human guidance","Patterns: PT-007","ABBs: AB-006","Gap","Medium","No feedback incorporation","Manual feedback processing with periodic retraining","Automated feedback integration with incremental learning","Continuous online learning with immediate behavior adaptation","Feedback incorporation rate (%) | Performance improvement from feedback (%) | Learning latency (hours) | User satisfaction trend"
"CP-113","Agentic AI","Agents","L2","capability-model","CAP-L2-AGT-02-04","Proactive Suggestions","Agents to anticipate user needs and proactively suggest actions, information, or optimizations before being explicitly asked, using predictive modeling and pattern recognition","Patterns: PT-007","ABBs: AB-001","Gap","Medium","Reactive only responses","Rule-based suggestions for common scenarios","ML-driven proactive suggestions with user modeling","Predictive proactive assistance with timing optimization and personalization","Suggestion acceptance rate (%) | Proactivity frequency | Suggestion relevance score | User satisfaction with proactivity"
"CP-114","Agentic AI","Agents","L2","capability-model","CAP-L2-AGT-03-01","Inter-Agent Communication","Enable structured communication and information exchange between multiple agents, supporting message passing, shared state, and coordination protocols for collaborative problem-solving","Patterns: PT-008","ABBs: AB-007","Gap","High","No inter-agent communication","Basic message passing between 2-3 agents","Structured protocols supporting 5-10 agents with message routing","Advanced communication fabric supporting 20+ agents with semantic messaging and negotiation","Message delivery success rate (%) | Communication latency (ms) | Protocol compliance (%) | Coordination efficiency"
"CP-115","Agentic AI","Agents","L2","capability-model","CAP-L2-AGT-03-02","Agent Specialization","Develop and deploy domain-specific expert agents with specialized knowledge, skills, and tools, enabling division of labor and depth of expertise across the agent ecosystem","Patterns: PT-008","ABBs: AB-001","Gap","Medium","General-purpose agents only","2-3 specialist agent types","5-10 specialist types with clear domain boundaries","Dynamic specialization with 20+ types and automatic skill development","Number of specialist types | Specialization depth score | Task-specialist matching accuracy (%) | Specialist utilization rate (%)"
"CP-116","Agentic AI","Agents","L2","capability-model","CAP-L2-AGT-03-03","Result Aggregation","Combine and synthesize outputs from multiple agents working in parallel or sequence, resolving conflicts, identifying consensus, and producing coherent unified results","Patterns: PT-008","ABBs: AB-005","Gap","Medium","Manual result combination","Simple voting or averaging mechanisms","Weighted aggregation with quality scoring","Intelligent synthesis with conflict resolution and confidence-based weighting","Aggregation quality score | Conflict resolution success rate (%) | Synthesis latency (seconds) | Result consistency score"
"CP-117","Agentic AI","Agents","L2","capability-model","CAP-L2-AGT-03-04","Conflict Resolution","Identify and resolve disagreements between agents when they propose conflicting actions or reach different conclusions, using negotiation, voting, or arbitration mechanisms","Patterns: PT-008","ABBs: AB-006","Gap","Medium","No conflict detection","Simple rule-based conflict resolution","Negotiation protocols with stakeholder weighting","AI-mediated conflict resolution with optimal compromise finding","Conflict detection rate (%) | Resolution success rate (%) | Resolution time (seconds) | Stakeholder satisfaction with resolutions"
"CP-118","Agentic AI","Agents","L2","capability-model","CAP-L2-AGT-04-01","Human-in-the-Loop","Integrate human oversight and approval into agent workflows, implementing checkpoints for high-risk decisions, enabling human intervention, and learning from human guidance","Patterns: PT-007","ABBs: AB-008","Gap","High","Manual review of all actions","Selective review of flagged high-risk actions","Risk-based routing with approval workflows and SLA management","Intelligent approval routing with predictive risk assessment and parallel review","Review response time (minutes) | Approval override rate (%) | Risk prediction accuracy (%) | Human intervention efficiency"
"CP-119","Agentic AI","Agents","L2","capability-model","CAP-L2-AGT-04-02","Agent Cost Monitoring","Track, attribute, and control costs associated with agent operations including LLM token usage, API calls, compute resources, enabling budget management and cost optimization","Patterns: PT-007","ABBs: AB-009","Gap","High","No cost tracking","Basic cost logging with monthly reports","Real-time cost monitoring with budget alerts","Predictive cost management with automatic optimization and budget enforcement","Cost per agent task ($) | Budget compliance rate (%) | Cost prediction accuracy (%) | Cost optimization savings (%)"
"CP-120","Agentic AI","Agents","L2","capability-model","CAP-L2-AGT-04-03","Agent Versioning","Manage versions of agent configurations, prompts, models, and behaviors, enabling controlled deployments, A/B testing, rollbacks, and tracking of agent evolution over time","Patterns: PT-007","ABBs: AB-010","Gap","Medium","No version control","Manual versioning with basic rollback","Automated versioning with semantic versioning and deployment gates","Full lifecycle management with A/B testing and performance-based promotion","Version deployment frequency | Rollback success rate (%) | Version tracking completeness (%) | A/B test win rate (%)"
"CP-121","Agentic AI","Agents","L2","capability-model","CAP-L2-AGT-04-04","Agent Audit Trail","Maintain comprehensive immutable logs of all agent decisions, actions, and interactions, providing complete traceability for compliance, debugging, and accountability purposes","Patterns: PT-007","ABBs: AB-065","Gap","High","Basic logging with limited retention","Structured logging with 90 day retention","Comprehensive audit trail with full lineage and long-term retention","Blockchain-backed immutable audit with real-time analysis and anomaly detection","Audit log completeness (%) | Trace reconstruction success rate (%) | Audit query latency (seconds) | Compliance coverage (%)"
"CP-122","Agentic AI","Low Code Agentic","L2","placeholder","PLACEHOLDER-LOW-CODE-AGENTIC","Copilot Studio Agents","Build agents using Microsoft Copilot Studio","","","Planned","","","","","",""
"CP-123","Agentic AI","Low Code Agentic","L2","placeholder","PLACEHOLDER-LOW-CODE-AGENTIC","Power Platform Automation","AI-powered automation using Power Platform","","","Planned","","","","","",""
"CP-124","Agentic AI","Low Code Agentic","L2","placeholder","PLACEHOLDER-LOW-CODE-AGENTIC","AgentForce Integration","Salesforce AgentForce agent development","","","Planned","","","","","",""
"CP-125","Agentic AI","High Code Agentic","L2","placeholder","PLACEHOLDER-HIGH-CODE-AGENTIC","LangGraph Workflows","Build complex agent workflows using LangGraph","","","Planned","","","","","",""
"CP-126","Agentic AI","High Code Agentic","L2","placeholder","PLACEHOLDER-HIGH-CODE-AGENTIC","CrewAI Multi-Agent","Multi-agent orchestration using CrewAI framework","","","Planned","","","","","",""
"CP-127","Agentic AI","High Code Agentic","L2","placeholder","PLACEHOLDER-HIGH-CODE-AGENTIC","Semantic Kernel Agents","Agent development using Microsoft Semantic Kernel","","","Planned","","","","","",""
"CP-128","Generative AI","LLMs","L1","capability-model","CAP-L1-GEN-01","LLM Orchestration","L1 Capability Group: LLM Orchestration","","","","","","","","",""
"CP-129","Generative AI","LLMs","L2","capability-model","CAP-L2-GEN-01-01","LLM Gateway","Provide unified API access to multiple LLM providers (OpenAI, Anthropic, Azure, AWS Bedrock) through a single interface, enabling vendor-agnostic development and avoiding lock-in","Patterns: PT-006","ABBs: AB-050","Gap","High","Direct integration to single LLM provider","Gateway supporting 2-3 providers with manual failover","Unified gateway for 5+ providers with automatic failover and load balancing","Intelligent gateway with 10+ providers including on-premises models and dynamic provider selection","Number of providers supported | Gateway uptime (%) | Failover time (seconds) | Provider abstraction completeness (%)"
"CP-130","Generative AI","LLMs","L2","capability-model","CAP-L2-GEN-01-02","Multi-Model Routing","Intelligently route LLM requests to the most appropriate model based on task characteristics, performance requirements, and business constraints, optimizing for cost, quality, and latency","Patterns: PT-006","ABBs: AB-108","Gap","High","Static model selection","Rule-based routing with 2-3 routing rules","ML-driven routing with 5+ factors and performance tracking","Adaptive routing with continuous learning and multi-objective optimization","Routing accuracy (%) | Cost savings from optimal routing (%) | Quality maintenance rate (%) | Routing decision latency (ms)"
"CP-131","Generative AI","LLMs","L2","capability-model","CAP-L2-GEN-01-03","Cost-Based Routing","Route LLM requests to cost-optimal models while maintaining quality thresholds, enabling intelligent cost management across model portfolio","Patterns: PT-006","ABBs: AB-109","Gap","High","No cost-aware routing","Manual cost optimization","Automated routing with cost targets and quality floors","Dynamic cost optimization with real-time budget management and predictive scaling","Average cost per request ($) | Cost reduction vs baseline (%) | Quality degradation rate (%) | Budget compliance (%)"
"CP-132","Generative AI","LLMs","L2","capability-model","CAP-L2-GEN-01-04","Latency-Based Routing","Route requests to models that meet specific latency requirements, ensuring responsive user experiences while optimizing resource utilization","Patterns: PT-006","ABBs: AB-110","Gap","High","No latency-aware routing","Basic latency targeting","Intelligent routing with P95 latency guarantees","Predictive routing with proactive capacity management and edge optimization","P95 response latency (ms) | Latency SLA compliance (%) | Timeout rate (%) | Regional optimization effectiveness"
"CP-133","Generative AI","LLMs","L2","capability-model","CAP-L2-GEN-01-05","Capability-Based Routing","Match requests to models based on their specialized capabilities (coding, reasoning, multilingual, long-context) ensuring optimal model-task alignment for best results","Patterns: PT-006","ABBs: AB-111","Gap","High","Single general-purpose model","Manual selection from 3-5 models","Automated capability matching for 10+ specialized models","Self-learning capability mapping with task-model performance tracking","Capability matching accuracy (%) | Task success rate (%) | Model capability coverage | Utilization efficiency by model type"
"CP-134","Generative AI","RAG","L1","capability-model","CAP-L1-GEN-02","Retrieval-Augmented Generation","L1 Capability Group: Retrieval-Augmented Generation","","","","","","","","",""
"CP-135","Generative AI","RAG","L2","capability-model","CAP-L2-GEN-02-01","Semantic Search","Perform vector-based semantic search over document collections, finding information based on meaning rather than keyword matches, enabling more accurate and contextual information retrieval","Patterns: PT-005","ABBs: AB-052","Gap","High","Keyword search only","Basic vector search with single embedding model","Multi-vector search with hybrid scoring and re-ranking","Advanced semantic search with query expansion and cross-lingual retrieval","Search relevance (NDCG@10) | Query response time (ms) | Search recall rate (%) | User satisfaction with results"
"CP-136","Generative AI","RAG","L2","capability-model","CAP-L2-GEN-02-02","Hybrid Search","Combine keyword-based lexical search with semantic vector search, leveraging strengths of both approaches for optimal retrieval performance across diverse query types","Patterns: PT-005","ABBs: AB-054","Gap","High","Semantic or keyword only","Basic hybrid with fixed weighting","Adaptive hybrid with query-specific weighting","Intelligent hybrid with learned fusion and query understanding","Retrieval accuracy (%) | Search latency (ms) | Hybrid effectiveness gain vs single method (%) | Query type coverage"
"CP-137","Generative AI","RAG","L2","capability-model","CAP-L2-GEN-02-03","Document Reranking","Reorder initially retrieved documents using more sophisticated relevance models, improving precision of top results presented to users or used for generation","Patterns: PT-005","ABBs: AB-055","Gap","High","No reranking","Basic score-based reranking","Cross-encoder reranking with context","Multi-stage reranking with diversity optimization and user feedback","Reranking effectiveness (NDCG improvement) | Reranking latency (ms) | Top-5 precision improvement (%) | User click-through rate"
"CP-138","Generative AI","RAG","L2","capability-model","CAP-L2-GEN-02-04","Query Rewriting","Reformulate and expand user queries to improve retrieval effectiveness, handling ambiguity, expanding abbreviations, and generating multiple query variations","Patterns: PT-005","ABBs: AB-059","Gap","High","No query modification","Rule-based query expansion","ML-based query rewriting with synonym expansion","LLM-powered query understanding with multi-query generation and intent preservation","Query rewrite effectiveness (%) | Retrieval improvement from rewriting (%) | Rewrite latency (ms) | User intent preservation rate (%)"
"CP-139","Generative AI","RAG","L2","capability-model","CAP-L2-GEN-02-05","Citation Generation","Automatically attribute and cite source documents in LLM-generated responses, providing transparency, enabling verification, and meeting regulatory requirements for source disclosure","Patterns: PT-005","ABBs: AB-058","Gap","High","No source attribution","Basic document references","Inline citations with confidence scores","Granular citation with passage-level attribution and verification links","Citation accuracy (%) | Citation completeness (% of claims cited) | Citation generation latency (ms) | User trust score"
"CP-140","Generative AI","Content","L0","capability-model","CAP-L0-GEN: Generative AI","Generative AI","LLM orchestration, RAG, and generative capabilities","","","","","","","","",""
"CP-141","Generative AI","Content","L1","capability-model","CAP-L1-GEN-03","Content Generation","L1 Capability Group: Content Generation","","","","","","","","",""
"CP-142","Generative AI","Content","L1","capability-model","CAP-L1-GEN-04","Document Intelligence","L1 Capability Group: Document Intelligence","","","","","","","","",""
"CP-143","Generative AI","Content","L2","capability-model","CAP-L2-GEN-03-01","Text Generation","Generate coherent, contextually appropriate natural language text for various purposes including content creation, communication, documentation, and creative writing using large language models","Patterns: PT-005, PT-007","ABBs: AB-050","Gap","High","Template-based text generation","Basic LLM generation with prompt engineering","Advanced generation with style control and factual grounding","Multi-modal generation with adaptive tone and personalization","Generation quality score | Text coherence (%) | Factual accuracy (%) | Generation latency (seconds)"
"CP-144","Generative AI","Content","L2","capability-model","CAP-L2-GEN-03-02","Summarization","Automatically generate concise summaries of long documents, articles, or conversations, extracting key information while maintaining coherence and fidelity to source content","Patterns: PT-013","ABBs: AB-035","Gap","High","Extractive summarization only","Basic abstractive summarization","Multi-document summarization with customizable length and focus","Hierarchical summarization with key insight extraction and query-focused summaries","Summary quality (ROUGE score) | Compression ratio | Fact preservation rate (%) | Summary generation time (seconds)"
"CP-145","Generative AI","Content","L2","capability-model","CAP-L2-GEN-03-03","Natural Language Generation","Convert structured data, tables, and databases into natural language narratives, enabling data-driven storytelling and automated report generation","Patterns: PT-004","ABBs: AB-094","Gap","Medium","Template-based data-to-text","Rule-based NLG with basic customization","Neural NLG with context-aware generation","Adaptive NLG with audience-specific narratives and insight highlighting","Generated text quality score | Data fidelity (%) | Readability score | Narrative coherence"
"CP-146","Generative AI","Content","L2","capability-model","CAP-L2-GEN-03-04","Self-Critique","AI systems to evaluate and refine their own generated outputs through self-reflection, identifying errors, inconsistencies, and opportunities for improvement","Patterns: PT-005","ABBs: AB-056","Gap","Medium","No self-evaluation","Basic quality scoring","Iterative refinement with multi-criteria evaluation","Continuous self-improvement with learned quality models","Self-critique accuracy (%) | Quality improvement from refinement (%) | Critique latency (seconds) | Error detection rate (%)"
"CP-147","Generative AI","Content","L2","capability-model","CAP-L2-GEN-04-01","Document Classification","Automatically categorize documents into predefined types and categories based on content, structure, and metadata, enabling efficient document routing and organization","Patterns: PT-011","ABBs: AB-040","Gap","High","Manual classification","Rule-based classification with 5-10 categories","ML classification with 20-50 categories at 90%+ accuracy","Deep learning classification with 100+ categories and hierarchical taxonomies at 95%+ accuracy","Classification accuracy (%) | Processing throughput (docs/minute) | Number of categories supported | Multi-label classification F1 score"
"CP-148","Generative AI","Content","L2","capability-model","CAP-L2-GEN-04-02","OCR & Text Extraction","Extract text content from scanned documents, images, and PDFs using optical character recognition, preserving layout and structure information","Patterns: PT-011","ABBs: AB-041","Gap","High","Basic OCR for clean documents","Advanced OCR with layout preservation","Multi-language OCR with handwriting recognition","AI-enhanced OCR with context-based error correction and table extraction","OCR accuracy (%) | Processing speed (pages/minute) | Language coverage | Layout preservation score"
"CP-149","Generative AI","Content","L2","capability-model","CAP-L2-GEN-04-03","Entity Extraction","Identify and extract structured information entities (names, addresses, account numbers, dates) from unstructured documents enabling automated data capture and processing","Patterns: PT-011","ABBs: AB-095","Gap","High","Pattern matching for fixed entities","ML-based NER for standard entity types","Domain-specific entity extraction with relationship extraction","Context-aware extraction with entity disambiguation and validation","Entity extraction accuracy (%) | Entity types supported | Extraction speed (entities/second) | Relationship extraction F1 score"
"CP-150","Generative AI","Content","L2","capability-model","CAP-L2-GEN-04-04","Document Forensics","Detect document tampering and verify authenticity","Patterns: PT-011, PT-018","ABBs: AB-042","Gap","High","Manual document review","Automated metadata and format checking","AI-powered forgery detection with 94%+ accuracy","Real-time multi-modal authenticity verification","Fraud detection rate (%); False positive rate (%); Processing time (ms)"
"CP-151","Generative AI","Content","L2","capability-model","CAP-L2-GEN-04-05","Document Processing Pipeline","End-to-end document processing","Patterns: PT-011","ABBs: AB-057","","","","","","",""
"CP-152","Foundations","Models","L0","capability-model","CAP-L0-MOD: Model Lifecycle","Model Lifecycle","ML model development, training, and operations","","","","","","","","",""
"CP-153","Foundations","Models","L1","capability-model","CAP-L1-MOD-01","Model Development","L1 Capability Group: Model Development","","","","","","","","",""
"CP-154","Foundations","Models","L1","capability-model","CAP-L1-MOD-02","Model Serving","L1 Capability Group: Model Serving","","","","","","","","",""
"CP-155","Foundations","Models","L1","capability-model","CAP-L1-MOD-03","Model Operations","L1 Capability Group: Model Operations","","","","","","","","",""
"CP-156","Foundations","Models","L1","capability-model","CAP-L1-MOD-04","Model Testing","L1 Capability Group: Model Testing","","","","","","","","",""
"CP-157","Foundations","Models","L1","capability-model","CAP-L1-MOD-05","Model Optimization","L1 Capability Group: Model Optimization","","","","","","","","",""
"CP-158","Foundations","Models","L2","Models","1. Model Governance & Compliance","1.1 Model Registry & Cataloging","The ability to maintain a centralized, authoritative repository for cataloging, versioning, and tracking all AI/ML models across the organization, providing comprehensive metadata management, lineage tracking, and model discovery capabilities","Centralized Model Repository; Metadata Management; Version Control; Lineage Tracking; Model Discovery; Access Control","MLflow Model Registry, SageMaker Model Registry, Vertex AI Model Registry, Azure ML Model Registry, Databricks Unity Catalog, DVC (Data Version Control), Model cards","Gap","High","Manual model registration, spreadsheet tracking, <50 models","Automated registration via CI/CD, 50-200 models, basic metadata","Centralized registry, 200-1000 models, comprehensive lineage, automated discovery","1000+ models, multi-cloud registry, self-service discovery, automated governance checks, semantic versioning enforced","Number of models registered; Model registration automation rate (%); Time to discover relevant model (minutes); Metadata completeness score (%); Model reuse rate (%)"
