"ID","L0_Domain","L1_Group","Level","Source","Primary_Capability","Capability_Name","Definition","Key_Components","Technologies","BNZ_Status","Priority","Maturity_Basic","Maturity_Intermediate","Maturity_Advanced","Maturity_Optimized","Success_Metrics"
"CP-211","Foundations","Models","L2","capability-model","CAP-L2-MOD-05-03","Hyperparameter Tuning","Systematically optimize model hyperparameters using grid search, random search, Bayesian optimization, or other techniques to maximize model performance","Patterns: PT-002","ABBs: AB-085","Gap","High","Manual hyperparameter tuning","Grid search or random search","Bayesian optimization with early stopping","Multi-fidelity optimization with meta-learning","Performance improvement from tuning (%) | Tuning time (hours) | Number of hyperparameters optimized | Tuning automation rate (%)"
"CP-212","Foundations","Models","L2","capability-model","CAP-L2-MOD-05-04","Model Fallback","Gracefully handle model failures, timeouts, or errors by falling back to simpler models, cached predictions, or default responses","Patterns: PT-006, PT-009","ABBs: AB-090, AB-083","Gap","High","No fallback mechanism","Static fallback to default model","Dynamic fallback with health-based routing","Intelligent fallback with quality-aware degradation","Fallback activation rate (%) | Service continuity during model failure (%) | Fallback response quality vs primary (%) | Recovery time (seconds)"
"CP-213","Foundations","Data & Knowledge","L0","capability-model","CAP-L0-DAT: Data & Knowledge","Data & Knowledge","Data management, feature engineering, and knowledge systems","","","","","","","","",""
"CP-214","Foundations","Data & Knowledge","L1","capability-model","CAP-L1-DAT-01","Feature Management","L1 Capability Group: Feature Management","","","","","","","","",""
"CP-215","Foundations","Data & Knowledge","L1","capability-model","CAP-L1-DAT-02","Data Storage & Management","L1 Capability Group: Data Storage & Management","","","","","","","","",""
"CP-216","Foundations","Data & Knowledge","L1","capability-model","CAP-L1-DAT-03","Knowledge Management","L1 Capability Group: Knowledge Management","","","","","","","","",""
"CP-217","Foundations","Data & Knowledge","L1","capability-model","CAP-L1-DAT-04","Data Products","L1 Capability Group: Data Products","","","","","","","","",""
"CP-218","Foundations","Data & Knowledge","L1","capability-model","CAP-L1-DAT-05","Data Integration","L1 Capability Group: Data Integration","","","","","","","","",""
"CP-219","Foundations","Data & Knowledge","L2","Data & Knowledge","1. Knowledge Capture & Ingestion","1.1 Data Source Integration","The ability to connect to and extract data from multiple enterprise systems, applications, and external sources","Enterprise System Connectors; API Integration Framework; Database Connectivity; File System Integration; Web Scraping & Crawling","Apache NiFi, AWS Glue, Azure Data Factory; Custom connectors and adapters; OAuth 2.0 authentication frameworks","Gap","Low","Manual file uploads, single source integration","5-10 automated source connectors, scheduled batch processing","20+ source connectors, real-time integration, error handling","50+ sources, self-service connector creation, intelligent routing","Number of integrated data sources; Integration reliability (uptime %); Time to integrate new source (hours); Data ingestion throughput (GB/hour)"
"CP-220","Foundations","Data & Knowledge","L2","Data & Knowledge","1. Knowledge Capture & Ingestion","1.2 Document Processing & Extraction","Analyze and extract structured information from unstructured documents including text, tables, images, and complex layouts","OCR (Optical Character Recognition); Table Extraction; Layout Analysis; Entity Extraction; Metadata Extraction","AWS Textract, Azure Form Recognizer, Google Document AI; Apache Tika; spaCy, Stanford NER; Custom ML models","Gap","Low","Text extraction from common formats (PDF, DOCX)","Table extraction, basic entity recognition, 85%+ accuracy","Multi-modal processing, 95%+ accuracy, confidence scoring","Self-improving extraction, domain-specific models, 98%+ accuracy","Extraction accuracy rate (%); Processing speed (documents/minute); Supported document formats (#); Error rate in table extraction (%)"
"CP-221","Foundations","Data & Knowledge","L2","Data & Knowledge","1. Knowledge Capture & Ingestion","1.3 Metadata Enrichment","Enhance captured knowledge with additional contextual information, classifications, and semantic annotations","Automatic Tagging; Sentiment Analysis; Topic Modeling; Language Detection; Quality Scoring; Temporal Analysis","NLP libraries (spaCy, NLTK, Hugging Face Transformers); Topic modeling (LDA, BERTopic); Sentiment analysis models; Custom classification models","Gap","Low","Manual tagging, basic categories","Automated tagging, 10-20 categories, 80%+ accuracy","Multi-label classification, 50+ categories, sentiment analysis","Contextual enrichment, custom ontologies, confidence scoring","Tagging accuracy (%); Number of metadata fields enriched; Enrichment processing time (seconds/document); User acceptance rate of automatic tags (%)"
"CP-222","Foundations","Data & Knowledge","L2","Data & Knowledge","1. Knowledge Capture & Ingestion","1.4 Real-Time Knowledge Streaming","Capture and process knowledge as it is created or modified, enabling immediate availability for consumption","Event Stream Processing; Change Data Capture (CDC); Message Queue Integration; Stream Processing; Incremental Updates","Apache Kafka; Debezium for CDC; AWS Kinesis Data Streams; Apache Flink","Gap","Low","Batch updates every 24 hours","Batch updates every hour, basic streaming","Real-time streaming for critical sources, <5 min latency","Sub-second latency, event-driven architecture, 99.9% reliability","End-to-end latency (seconds); Event throughput (events/second); Stream processing reliability (%); Number of real-time sources"
"CP-223","Foundations","Data & Knowledge","L2","Data & Knowledge","2. Knowledge Organization & Modeling","2.1 Knowledge Graph Construction","The ability to build and maintain enterprise knowledge graphs that represent entities, relationships, and attributes in a connected graph structure","Graph Schema Design; Entity Extraction; Relationship Extraction; Graph Population; Graph Evolution; Property Enrichment","Neo4j, Amazon Neptune, Azure Cosmos DB (Gremlin API); Graph query languages (Cypher, Gremlin, SPARQL); Entity linking frameworks; Graph ML libraries (NetworkX, PyG)","Gap","Low","Simple graph with 100-1K entities, manual construction","10K-100K entities, automated extraction, 5-10 entity types","100K-1M entities, 20+ entity types, complex relationships","1M+ entities, self-evolving graph, inference capabilities","Number of entities in graph; Number of relationships; Graph completeness score (%); Query response time (ms)"
"CP-224","Foundations","Data & Knowledge","L2","Data & Knowledge","2. Knowledge Organization & Modeling","2.2 Ontology Management","Define, maintain, and govern formal ontologies that establish common vocabularies, taxonomies, and semantic relationships","Ontology Definition; Concept Hierarchies; Property Definitions; Ontology Alignment; Reasoning Rules; Version Control","Protégé ontology editor; Apache Jena for RDF management; OWL API; SPARQL","Gap","Low","Flat taxonomy, simple hierarchies","Multi-level taxonomy, basic ontology with 50-100 concepts","Formal ontology with 200+ concepts, reasoning capabilities","Multiple aligned ontologies, automated reasoning, 500+ concepts","Number of ontology concepts; Ontology coverage (% of domain); Reasoning performance (inferences/second); Alignment accuracy with industry standards (%)"
"CP-225","Foundations","Data & Knowledge","L2","Data & Knowledge","2. Knowledge Organization & Modeling","2.3 Entity Resolution & Linking","Identify when different references represent the same real-world entity and link them together, enabling unified views across data sources","Entity Matching; Record Linkage; Disambiguation; Identity Management; Cross-Reference Mapping","Dedupe, RecordLinkage Python libraries; Fuzzy matching algorithms (Levenshtein, Jaro-Winkler); ML-based entity resolution models; Master Data Management (MDM) tools","Gap","Low","Manual entity matching, exact matches only","Fuzzy matching, rule-based resolution, 80%+ accuracy","ML-based resolution, probabilistic matching, 90%+ accuracy","Real-time resolution, multi-source reconciliation, 95%+ accuracy","Entity resolution accuracy (%); False positive rate (%); Processing time per entity (ms); Coverage across data sources (%)"
"CP-226","Foundations","Data & Knowledge","L2","Data & Knowledge","2. Knowledge Organization & Modeling","2.4 Relationship Modeling","Identify, classify, and model relationships between entities, enabling graph traversal and multi-hop reasoning","Relationship Type Definition; Relationship Extraction; Relationship Validation; Temporal Relationships; Weighted Relationships; Hierarchical Relationships","Relation extraction models (SpanBERT, T5); Graph neural networks for link prediction; Rule-based relationship identification; Dependency parsing","Gap","Low","Simple relationships (links, references), manual creation","5-10 relationship types, basic automated extraction","20+ relationship types, weighted relationships, 85%+ accuracy","Complex relationships, temporal modeling, inference, 90%+ accuracy","Number of relationship types; Relationship extraction accuracy (%); Graph density (relationships per entity); Relationship coverage (% of possible connections)"
"CP-227","Foundations","Data & Knowledge","L2","Data & Knowledge","2. Knowledge Organization & Modeling","2.5 Taxonomy & Classification","Organize knowledge into hierarchical categories and apply consistent classification schemes across the enterprise","Taxonomy Design; Auto-Classification; Multi-Label Classification; Faceted Classification; Classification Validation; Taxonomy Evolution","Text classification models (BERT, RoBERTa, XGBoost); Hierarchical classification algorithms; Active learning; Taxonomy management tools","Gap","Low","Flat categories, manual classification","2-3 level hierarchy, automated classification, 80%+ accuracy","4+ levels, faceted classification, 90%+ accuracy","Dynamic taxonomies, confidence scoring, 95%+ accuracy","Classification accuracy (%); Taxonomy depth (levels); Coverage (% of content classified); User satisfaction with classifications (%)"
"CP-228","Foundations","Data & Knowledge","L2","Data & Knowledge","3. Knowledge Storage & Retrieval","3.1 Vector Database Management","Store, index, and retrieve high-dimensional vector embeddings for semantic similarity search","Vector Indexing; Embedding Storage; Similarity Search; Index Optimization; Batch Processing; Hybrid Search","Pinecone, Weaviate, Qdrant, Milvus; pgvector (PostgreSQL extension); Amazon OpenSearch with k-NN; FAISS","Gap","Low","<100K vectors, basic similarity search","1M-10M vectors, optimized indexes, <100ms query time","10M-100M vectors, distributed indexing, hybrid search","100M+ vectors, auto-scaling, multi-tenancy, <50ms query time","Number of vectors stored; Query latency (ms); Recall@K accuracy (%); Index update throughput (vectors/second)"
"CP-229","Foundations","Data & Knowledge","L2","Data & Knowledge","3. Knowledge Storage & Retrieval","3.2 Graph Database Management","Store and query graph-structured knowledge with native support for relationship traversal and pattern matching","Graph Schema Management; Graph Indexing; Multi-Hop Queries; Pattern Matching; Graph Algorithms; Transaction Management","Neo4j (Cypher queries); Amazon Neptune (Gremlin/SPARQL); ArangoDB (multi-model); TigerGraph; Postgres","Gap","Low","<10K nodes, simple queries, manual management","100K-1M nodes, complex queries, automated backups","1M-10M nodes, distributed graphs, advanced algorithms","10M+ nodes, sub-second multi-hop queries, real-time updates","Graph size (nodes + relationships); Query response time (ms); Graph algorithm performance; Data consistency score (%)"
"CP-230","Foundations","Data & Knowledge","L2","Data & Knowledge","3. Knowledge Storage & Retrieval","3.3 Embedding Generation & Management","Generate, version, and manage vector embeddings from text, images, and other content types","Embedding Models; Batch Embedding; Incremental Updates; Multi-Modal Embeddings; Embedding Quality; Model Versioning","OpenAI Embeddings API (text-embedding-ada-002); Sentence Transformers (SBERT); Cohere Embed models; Custom fine-tuned models; AWS Bedrock Embeddings","Gap","Low","Single embedding model, batch processing only","Multiple models, incremental updates, 1K embeddings/minute","Domain-specific models, real-time generation, 10K+/minute","Auto-model selection, quality monitoring, 100K+/minute","Embedding generation throughput (embeddings/second); Embedding quality score (retrieval accuracy); Model inference latency (ms); Storage efficiency (compression ratio)"
"CP-231","Foundations","Data & Knowledge","L2","Data & Knowledge","3. Knowledge Storage & Retrieval","3.4 Hybrid Storage Strategies","Intelligently combine multiple storage technologies (vector, graph, document, relational) for optimal performance and functionality","Storage Orchestration; Cross-Store Queries; Data Synchronization; Query Optimization; Unified Access Layer; Cost Optimization","Polyglot persistence patterns; GraphQL for unified queries; Change Data Capture; Apache Iceberg","Gap","Low","Single storage technology","2 storage types, manual data routing","3+ storage types, automated routing, cross-store queries","Dynamic routing, cost optimization, unified query interface","Query routing accuracy (%); Cross-store query performance; Storage cost efficiency ($/GB); Data consistency across stores (%)"
"CP-232","Foundations","Data & Knowledge","L2","Data & Knowledge","3. Knowledge Storage & Retrieval","3.5 Knowledge Versioning","Track changes to knowledge over time, maintaining historical versions and enabling rollback","Version Tracking; Diff Generation; Rollback Capability; Audit Trail; Branching; Merge Strategies","Git-like versioning systems; Temporal database features; Event sourcing patterns; Delta Lake","Gap","Low","No versioning, overwrites only","Simple version tracking, manual rollback","Automated versioning, diff views, branching support","Intelligent merging, temporal queries, audit compliance","Version retrieval time (ms); Storage overhead for versions (%); Rollback success rate (%); Audit trail completeness (%)"
"CP-233","Foundations","Data & Knowledge","L2","Data & Knowledge","4. Knowledge Access & Delivery","4.1 Semantic Search","Enable natural language search over enterprise knowledge using semantic understanding rather than keyword matching","Query Understanding; Semantic Matching; Contextual Ranking; Query Expansion; Faceted Search; Personalization","Dense retrieval models (DPR, ColBERT); Vector similarity search; Elasticsearch with k-NN plugin; Reranking models (Cross-Encoder)","Gap","Low","Keyword search with basic relevance","Vector-based search, 80%+ relevance at top-5","Contextual search, query expansion, 90%+ relevance","Personalized search, multi-modal, 95%+ relevance","Search relevance (NDCG@10); Query response time (ms); User click-through rate (%); Zero-result queries (%)"
"CP-234","Foundations","Data & Knowledge","L2","Data & Knowledge","4. Knowledge Access & Delivery","4.2 RAG (Retrieval Augmented Generation)","Ground large language model responses in enterprise knowledge by retrieving relevant context before generation","Retrieval Pipeline; Context Assembly; Prompt Engineering; Generation Control; Source Attribution; Hybrid RAG","LangChain, LlamaIndex; Vector databases; AWS Bedrock Knowledge Bases; Custom RAG pipelines","Gap","Low","Simple retrieval + LLM, no source attribution","Reranking, basic attribution, 80%+ answer quality","Hybrid retrieval, confidence scoring, 90%+ quality","Agentic RAG, self-correction, multi-hop reasoning, 95%+ quality","Answer accuracy (%); Source attribution accuracy (%); Hallucination rate (%); User satisfaction (rating)"
"CP-235","Foundations","Data & Knowledge","L2","Data & Knowledge","4. Knowledge Access & Delivery","4.3 Knowledge APIs & Interfaces","Expose knowledge through well-designed APIs and interfaces for programmatic access by agents and applications","RESTful APIs; GraphQL APIs; Streaming APIs; SDKs; API Gateway; API Documentation","FastAPI, Flask; GraphQL (Apollo, Hasura); AWS API Gateway, Kong; OpenAPI specifications; WebSocket","Gap","Low","Simple REST APIs, basic authentication","Multiple endpoints, rate limiting, API docs","GraphQL support, streaming, SDKs, 99%+ uptime","Self-service API creation, auto-scaling, <100ms latency","API response time (ms); API uptime (%); Number of API consumers; API error rate (%)"
"CP-236","Foundations","Data & Knowledge","L2","Data & Knowledge","4. Knowledge Access & Delivery","4.4 Context Assembly & Ranking","Intelligently select, combine, and rank knowledge fragments to provide optimal context for specific use cases","Relevance Scoring; Reranking; Diversity Control; Context Window Management; Deduplication; Citation Management","Cross-encoder reranking models; Maximum Marginal Relevance (MMR) algorithms; Custom ranking models; Context compression techniques","Gap","Low","Simple relevance scoring, no reranking","Reranking, deduplication, basic context management","Sophisticated ranking, diversity control, 90%+ precision","Adaptive ranking, context optimization, multi-objective ranking","Ranking accuracy (NDCG); Context quality score (%); Deduplication effectiveness (%); Processing latency (ms)"
"CP-237","Foundations","Data & Knowledge","L2","Data & Knowledge","4. Knowledge Access & Delivery","4.5 Multi-Modal Knowledge Access","Provide access to knowledge across different modalities (text, images, audio, video) with unified search and retrieval","Multi-Modal Embeddings; Cross-Modal Search; Visual Search; Audio/Video Processing; Document Understanding; Unified Indexing","CLIP for vision-language models; Whisper for audio transcription; Multi-modal embedding models; AWS Bedrock multi-modal models","Gap","Low","Text-only search","Text + image search, separate indexes","Cross-modal search, unified embeddings, 3+ modalities","Seamless multi-modal experience, 5+ modalities, real-time","Cross-modal search accuracy (%); Supported modalities (#); Multi-modal query latency (ms); User adoption of non-text search (%)"
"CP-238","Foundations","Data & Knowledge","L2","Data & Knowledge","5. Knowledge Governance & Quality","5.1 Knowledge Curation","Systematically review, validate, and improve knowledge quality through human and automated processes","Content Review Workflows; Expert Validation; Crowdsourced Curation; Automated Quality Checks; Knowledge Deprecation; Continuous Improvement","Workflow management systems; Collaborative editing platforms; Quality scoring algorithms; Feedback collection systems","Gap","Low","Ad-hoc manual reviews, no workflows","Basic review workflows, quarterly reviews","Automated quality checks, continuous curation, expert networks","AI-assisted curation, self-improving knowledge, real-time validation","Knowledge freshness (days since update); Curation completion rate (%); User-reported quality issues (#); Expert review coverage (%)"
"CP-239","Foundations","Data & Knowledge","L2","Data & Knowledge","5. Knowledge Governance & Quality","5.2 Data Quality Management","Measure, monitor, and improve the quality of knowledge across dimensions including accuracy, completeness, consistency, and timeliness","Quality Metrics; Data Profiling; Anomaly Detection; Duplicate Detection; Completeness Checks; Quality Scoring","Great Expectations; Apache Griffin; Custom quality rules engines; ML-based anomaly detection","Gap","Low","No quality measurement, reactive fixes","Basic quality metrics, monthly monitoring","Comprehensive quality framework, automated detection","Predictive quality management, auto-remediation, 99%+ quality","Data quality score (%); Quality issue detection rate (%); Time to resolve quality issues (hours); Quality trend (improving/stable/declining)"
"CP-240","Foundations","Data & Knowledge","L2","Data & Knowledge","5. Knowledge Governance & Quality","5.3 Access Control & Security","Secure knowledge through authentication, authorization, encryption, and audit controls","Authentication; Authorization; Encryption; Row-Level Security; Attribute-Based Access Control (ABAC); Security Monitoring","OAuth 2.0, SAML; Azure Entra ID, Okta; Policy engines (Open Policy Agent); Encryption: TLS 1.3, AES-256","Gap","Low","Basic authentication, coarse-grained access control","Fine-grained RBAC, encryption, audit logs","ABAC, row-level security, real-time monitoring","Zero-trust architecture, AI-driven threat detection, 99.99%+ security","Security incidents (#); Access policy coverage (%); Authentication success rate (%); Audit trail completeness (%)"
"CP-241","Foundations","Data & Knowledge","L2","Data & Knowledge","5. Knowledge Governance & Quality","5.4 Compliance & Audit","Ensure knowledge management practices meet regulatory requirements and provide comprehensive audit trails","Regulatory Mapping; Audit Logging; Compliance Reporting; Data Retention; Right to Erasure; Compliance Monitoring","Compliance management platforms; Audit log aggregation (Splunk, ELK); Data lineage tracking; Retention policy engines","Gap","Low","Manual compliance checks, basic logging","Automated compliance checks, structured audit logs","Real-time compliance monitoring, comprehensive audit trails","Predictive compliance, automated remediation, 100% audit coverage","Compliance audit pass rate (%); Audit trail completeness (%); Time to respond to compliance requests (hours); Regulatory violations (#)"
"CP-242","Foundations","Data & Knowledge","L2","Data & Knowledge","5. Knowledge Governance & Quality","5.5 Knowledge Lifecycle Management","Manage knowledge from creation through retirement, including versioning, archival, and disposal","Lifecycle Policies; Content Aging; Archival Strategies; Disposal Processes; Lifecycle Automation; Lifecycle Analytics","Lifecycle management platforms; Cold storage solutions (AWS Glacier, Azure Archive); Automated workflow systems; Data classification tools","Gap","Low","No lifecycle management, manual archival","Basic lifecycle policies, scheduled archival","Automated lifecycle, intelligent archival, 90%+ compliance","Predictive lifecycle management, cost optimization, 100% automation","Knowledge freshness score (%); Storage cost optimization ($/GB); Archival compliance rate (%); Lifecycle policy coverage (%)"
"CP-243","Foundations","Data & Knowledge","L2","capability-model","CAP-L2-DAT-01-01","Offline Feature Store","Store historical features for model training, providing point-in-time correct features with full lineage to prevent data leakage and ensure training-serving consistency","Patterns: PT-003","ABBs: AB-037, AB-049","Gap","High","Manual feature extraction for each model","Centralized feature storage with basic versioning","Point-in-time feature access with lineage tracking","Automated feature backfilling with time-travel queries","Feature reuse rate (%) | Feature freshness (hours) | Training data preparation time (hours) | Feature lineage completeness (%)"
"CP-244","Foundations","Data & Knowledge","L2","capability-model","CAP-L2-DAT-01-02","Online Feature Store","Serve pre-computed features in real-time with sub-10ms latency, enabling consistent feature access for both training and inference","Patterns: PT-003, PT-009","ABBs: AB-047","Gap","High","Real-time feature computation per request","Cached features with 100-500ms latency","Distributed feature store with <50ms latency","Ultra-low latency <10ms with edge caching and pre-computation","Feature serving latency P95 (ms) | Feature availability (%) | Cache hit rate (%) | Training-serving consistency (%)"
"CP-245","Foundations","Data & Knowledge","L2","capability-model","CAP-L2-DAT-01-03","Feature Engineering","Transform raw data into ML-ready features through aggregations, encodings, and transformations with reusability across models","Patterns: PT-003","ABBs: AB-048","Gap","High","Manual feature engineering per model","Reusable feature transformation pipelines","Automated feature engineering with feature discovery","AI-powered feature generation with semantic understanding","Number of reusable features | Feature engineering time reduction (%) | Model performance improvement from features (%) | Feature quality score"
"CP-246","Foundations","Data & Knowledge","L2","capability-model","CAP-L2-DAT-01-04","Feature Registry","Catalog available features with rich metadata including definitions, owners, lineage, and quality metrics enabling feature discovery and governance","Patterns: PT-003","ABBs: AB-037","Gap","High","No feature catalog","Spreadsheet-based feature inventory","Searchable feature registry with metadata","AI-powered feature discovery with recommendation","Number of registered features | Feature discovery time (minutes) | Metadata completeness (%) | Feature reuse rate (%)"
"CP-247","Foundations","Data & Knowledge","L2","capability-model","CAP-L2-DAT-01-05","Point-in-Time Joins","Perform temporally correct joins when creating training datasets, preventing data leakage by ensuring features use only information available at prediction time","Patterns: PT-003","ABBs: AB-037","Gap","High","No temporal awareness in joins","Manual point-in-time correct queries","Automated point-in-time joins with validation","Intelligent temporal join optimization with leakage detection","Data leakage prevention rate (%) | Join query performance | Training data quality score | Temporal correctness validation (%)"
